# tcpdump -n -i eth0
tcpdump: verbose output suppressed, use -v[v]... for full protocol decode
listening on eth0, link-type EN10MB (Ethernet), snapshot length 262144 bytes
23:00:26.790637 IP 143.110.216.5.22 > 99.238.174.44.51339: Flags [P.], seq 341637371:341637559, ack 3126186189, win 521, length 188
23:00:26.795565 IP 99.238.174.44.51339 > 143.110.216.5.22: Flags [P.], seq 1:37, ack 4294967244, win 1022, length 36
23:00:26.795704 IP 143.110.216.5.22 > 99.238.174.44.51339: Flags [P.], seq 188:224, ack 37, win 521, length 36
23:00:26.804292 IP 99.238.174.44.51339 > 143.110.216.5.22: Flags [.], ack 188, win 1021, length 0
23:00:26.813027 IP 99.238.174.44.51339 > 143.110.216.5.22: Flags [P.], seq 37:73, ack 224, win 1021, length 36
23:00:26.813179 IP 143.110.216.5.22 > 99.238.174.44.51339: Flags [P.], seq 224:260, ack 73, win 521, length 36
23:00:26.836722 IP 99.238.174.44.51339 > 143.110.216.5.22: Flags [P.], seq 73:109, ack 260, win 1021, length 36
23:00:26.836898 IP 143.110.216.5.22 > 99.238.174.44.51339: Flags [P.], seq 260:296, ack 109, win 521, length 36
23:00:26.882180 IP 99.238.174.44.51339 > 143.110.216.5.22: Flags [P.], seq 109:145, ack 296, win 1021, length 36
23:00:26.882365 IP 143.110.216.5.22 > 99.238.174.44.51339: Flags [P.], seq 296:332, ack 145, win 521, length 36
23:00:26.883347 IP 213.209.159.159.10354 > 143.110.216.5.22: Flags [P.], seq 383480758:383480838, ack 1699509808, win 1024, length 80
23:00:26.883347 IP 213.209.159.159.10354 > 143.110.216.5.22: Flags [F.], seq 80, ack 1, win 1024, length 0
23:00:26.883392 IP 143.110.216.5 > 213.209.159.159: ICMP 143.110.216.5 tcp port 22 unreachable, length 128
23:00:26.883401 IP 143.110.216.5 > 213.209.159.159: ICMP 143.110.216.5 tcp port 22 unreachable, length 48
23:00:26.891964 IP 143.110.216.5.22 > 99.238.174.44.51339: Flags [P.], seq 332:1968, ack 145, win 521, length 1636
23:00:26.901388 IP 99.238.174.44.51339 > 143.110.216.5.22: Flags [P.], seq 145:181, ack 332, win 1021, length 36
23:00:26.901520 IP 143.110.216.5.22 > 99.238.174.44.51339: Flags [P.], seq 1968:2004, ack 181, win 521, length 36
23:00:26.910156 IP 99.238.174.44.51339 > 143.110.216.5.22: Flags [.], ack 1968, win 1023, length 0
23:00:26.942534 IP 99.238.174.44.51339 > 143.110.216.5.22: Flags [P.], seq 181:217, ack 2004, win 1023, length 36
23:00:26.942690 IP 143.110.216.5.22 > 99.238.174.44.51339: Flags [P.], seq 2004:2040, ack 217, win 521, length 36
23:00:26.972983 IP 99.238.174.44.51339 > 143.110.216.5.22: Flags [P.], seq 217:253, ack 2004, win 1023, length 36
23:00:26.973142 IP 143.110.216.5.22 > 99.238.174.44.51339: Flags [P.], seq 2040:2076, ack 253, win 521, length 36
23:00:26.995752 IP 143.110.216.5.22 > 99.238.174.44.51339: Flags [P.], seq 2076:2232, ack 253, win 521, length 156
23:00:26.996038 IP 143.110.216.5.22 > 99.238.174.44.51339: Flags [P.], seq 2232:3060, ack 253, win 521, length 828
23:00:27.005193 IP 99.238.174.44.51339 > 143.110.216.5.22: Flags [.], ack 3060, win 1019, length 0
23:00:27.005193 IP 99.238.174.44.51339 > 143.110.216.5.22: Flags [P.], seq 253:289, ack 2040, win 1023, length 36
23:00:27.005374 IP 143.110.216.5.22 > 99.238.174.44.51339: Flags [P.], seq 3060:3096, ack 289, win 521, length 36
23:00:27.024729 IP 99.238.174.44.51339 > 143.110.216.5.22: Flags [P.], seq 289:325, ack 3096, win 1019, length 36
23:00:27.024729 IP 99.238.174.44.51339 > 143.110.216.5.22: Flags [.], ack 3096, win 1019, length 0
23:00:27.024925 IP 143.110.216.5.22 > 99.238.174.44.51339: Flags [P.], seq 3096:3132, ack 325, win 521, length 36
23:00:27.044244 IP 99.238.174.44.51339 > 143.110.216.5.22: Flags [P.], seq 325:361, ack 3132, win 1019, length 36
23:00:27.044532 IP 143.110.216.5.22 > 99.238.174.44.51339: Flags [P.], seq 3132:3168, ack 361, win 521, length 36
23:00:27.085078 IP 99.238.174.44.51339 > 143.110.216.5.22: Flags [P.], seq 361:397, ack 3132, win 1019, length 36
23:00:27.085229 IP 143.110.216.5.22 > 99.238.174.44.51339: Flags [P.], seq 3168:3204, ack 397, win 521, length 36
23:00:27.091488 IP 143.110.216.5.22 > 213.209.159.159.10354: Flags [P.], seq 4294967217:1, ack 0, win 608, length 80
23:00:27.099829 IP 143.110.216.5.22 > 99.238.174.44.51339: Flags [P.], seq 3204:4712, ack 397, win 521, length 1508
23:00:27.104587 IP 99.238.174.44.51339 > 143.110.216.5.22: Flags [.], ack 3204, win 1019, length 0
23:00:27.104587 IP 99.238.174.44.51339 > 143.110.216.5.22: Flags [P.], seq 397:433, ack 3132, win 1019, length 36
23:00:27.104733 IP 143.110.216.5.22 > 99.238.174.44.51339: Flags [P.], seq 4712:4748, ack 433, win 521, length 36
23:00:27.121806 IP 99.238.174.44.51339 > 143.110.216.5.22: Flags [P.], seq 433:469, ack 4712, win 1023, length 36
23:00:27.121880 IP 99.238.174.44.51339 > 143.110.216.5.22: Flags [.], ack 4712, win 1023, length 0
23:00:27.122019 IP 143.110.216.5.22 > 99.238.174.44.51339: Flags [P.], seq 4748:4784, ack 469, win 521, length 36
23:00:27.149897 IP 99.238.174.44.51339 > 143.110.216.5.22: Flags [P.], seq 469:505, ack 4748, win 1023, length 36
23:00:27.150058 IP 143.110.216.5.22 > 99.238.174.44.51339: Flags [P.], seq 4784:4820, ack 505, win 521, length 36
23:00:27.169330 IP 99.238.174.44.51339 > 143.110.216.5.22: Flags [P.], seq 505:541, ack 4820, win 1023, length 36
23:00:27.169331 IP 99.238.174.44.51339 > 143.110.216.5.22: Flags [.], ack 4820, win 1023, length 0
23:00:27.169525 IP 143.110.216.5.22 > 99.238.174.44.51339: Flags [P.], seq 4820:4856, ack 541, win 521, length 36
23:00:27.183835 IP 213.209.159.159.10354 > 143.110.216.5.22: Flags [FP.], seq 0:80, ack 1, win 1024, length 80
23:00:27.183894 IP 143.110.216.5 > 213.209.159.159: ICMP 143.110.216.5 tcp port 22 unreachable, length 128
23:00:27.186424 IP 213.209.159.159.10354 > 143.110.216.5.22: Flags [.], ack 1, win 1024, options [nop,nop,sack 1 {4294967217:1}], length 0
23:00:27.186471 IP 143.110.216.5 > 213.209.159.159: ICMP 143.110.216.5 tcp port 22 unreachable, length 60
23:00:27.197309 IP 216.180.246.105.21866 > 143.110.216.5.8812: Flags [S], seq 356641342, win 1025, options [mss 1460], length 0
23:00:27.203910 IP 143.110.216.5.22 > 99.238.174.44.51339: Flags [P.], seq 4856:6828, ack 541, win 521, length 1972
23:00:27.206035 IP 99.238.174.44.51339 > 143.110.216.5.22: Flags [P.], seq 541:577, ack 4820, win 1023, length 36
23:00:27.206211 IP 143.110.216.5.22 > 99.238.174.44.51339: Flags [P.], seq 6828:6864, ack 577, win 521, length 36
23:00:27.212790 IP 99.238.174.44.51339 > 143.110.216.5.22: Flags [.], ack 6828, win 1023, length 0
23:00:27.218972 IP 99.238.174.44.51339 > 143.110.216.5.22: Flags [P.], seq 577:613, ack 6828, win 1023, length 36
23:00:27.219178 IP 143.110.216.5.22 > 99.238.174.44.51339: Flags [P.], seq 6864:6900, ack 613, win 521, length 36
23:00:27.231965 IP 99.238.174.44.51339 > 143.110.216.5.22: Flags [.], ack 6900, win 1023, length 0
23:00:27.257822 IP 99.238.174.44.51339 > 143.110.216.5.22: Flags [P.], seq 613:649, ack 6900, win 1023, length 36
23:00:27.257978 IP 143.110.216.5.22 > 99.238.174.44.51339: Flags [P.], seq 6900:6936, ack 649, win 521, length 36
23:00:27.273121 IP 99.238.174.44.51339 > 143.110.216.5.22: Flags [P.], seq 649:685, ack 6936, win 1023, length 36
23:00:27.273282 IP 143.110.216.5.22 > 99.238.174.44.51339: Flags [P.], seq 6936:6972, ack 685, win 521, length 36
23:00:27.303359 IP 99.238.174.44.51339 > 143.110.216.5.22: Flags [P.], seq 685:721, ack 6972, win 1023, length 36
23:00:27.303543 IP 143.110.216.5.22 > 99.238.174.44.51339: Flags [P.], seq 6972:7008, ack 721, win 521, length 36
23:00:27.307840 IP 143.110.216.5.22 > 99.238.174.44.51339: Flags [P.], seq 7008:8516, ack 721, win 521, length 1508
23:00:27.337816 IP 99.238.174.44.51339 > 143.110.216.5.22: Flags [P.], seq 721:757, ack 7008, win 1023, length 36
23:00:27.337816 IP 99.238.174.44.51339 > 143.110.216.5.22: Flags [.], ack 8516, win 1023, length 0
23:00:27.338010 IP 143.110.216.5.22 > 99.238.174.44.51339: Flags [P.], seq 8516:8552, ack 757, win 521, length 36
23:00:27.344499 IP 99.238.174.44.51339 > 143.110.216.5.22: Flags [P.], seq 757:793, ack 8516, win 1023, length 36
23:00:27.344675 IP 143.110.216.5.22 > 99.238.174.44.51339: Flags [P.], seq 8552:8588, ack 793, win 521, length 36
23:00:27.366018 IP 99.238.174.44.51339 > 143.110.216.5.22: Flags [P.], seq 793:829, ack 8588, win 1023, length 36
23:00:27.366018 IP 99.238.174.44.51339 > 143.110.216.5.22: Flags [.], ack 8588, win 1023, length 0
23:00:27.366250 IP 143.110.216.5.22 > 99.238.174.44.51339: Flags [P.], seq 8588:8624, ack 829, win 521, length 36
23:00:27.387503 IP 99.238.174.44.51339 > 143.110.216.5.22: Flags [P.], seq 829:865, ack 8588, win 1023, length 36
23:00:27.387663 IP 143.110.216.5.22 > 99.238.174.44.51339: Flags [P.], seq 8624:8660, ack 865, win 521, length 36
23:00:27.395499 IP 143.110.216.5.22 > 213.209.159.159.10354: Flags [P.], seq 4294967217:1, ack 0, win 608, length 80
23:00:27.409164 IP 99.238.174.44.51339 > 143.110.216.5.22: Flags [P.], seq 865:901, ack 8660, win 1023, length 36
23:00:27.409165 IP 99.238.174.44.51339 > 143.110.216.5.22: Flags [.], ack 8660, win 1023, length 0
23:00:27.409317 IP 143.110.216.5.22 > 99.238.174.44.51339: Flags [P.], seq 8660:8696, ack 901, win 521, length 36
23:00:27.411852 IP 143.110.216.5.22 > 99.238.174.44.51339: Flags [P.], seq 8696:10420, ack 901, win 521, length 1724
23:00:27.439427 IP 99.238.174.44.51339 > 143.110.216.5.22: Flags [.], ack 10420, win 1023, length 0
23:00:27.439428 IP 99.238.174.44.51339 > 143.110.216.5.22: Flags [P.], seq 901:937, ack 8660, win 1023, length 36
23:00:27.439616 IP 143.110.216.5.22 > 99.238.174.44.51339: Flags [P.], seq 10420:10456, ack 937, win 521, length 36
23:00:27.460843 IP 99.238.174.44.51339 > 143.110.216.5.22: Flags [P.], seq 937:973, ack 10456, win 1023, length 36
23:00:27.460901 IP 99.238.174.44.51339 > 143.110.216.5.22: Flags [.], ack 10456, win 1023, length 0
23:00:27.461030 IP 143.110.216.5.22 > 99.238.174.44.51339: Flags [P.], seq 10456:10492, ack 973, win 521, length 36
23:00:27.484695 IP 99.238.174.44.51339 > 143.110.216.5.22: Flags [P.], seq 973:1009, ack 10456, win 1023, length 36
23:00:27.484858 IP 143.110.216.5.22 > 99.238.174.44.51339: Flags [P.], seq 10492:10528, ack 1009, win 521, length 36
23:00:27.490506 IP 213.209.159.159.10354 > 143.110.216.5.22: Flags [.], ack 1, win 1024, options [nop,nop,sack 1 {4294967217:1}], length 0
23:00:27.490568 IP 143.110.216.5 > 213.209.159.159: ICMP 143.110.216.5 tcp port 22 unreachable, length 60
23:00:27.497929 IP 213.209.159.159.10354 > 143.110.216.5.22: Flags [FP.], seq 0:80, ack 1, win 1024, length 80
23:00:27.497978 IP 143.110.216.5 > 213.209.159.159: ICMP 143.110.216.5 tcp port 22 unreachable, length 128
23:00:27.504115 IP 99.238.174.44.51339 > 143.110.216.5.22: Flags [P.], seq 1009:1045, ack 10528, win 1023, length 36
23:00:27.504116 IP 99.238.174.44.51339 > 143.110.216.5.22: Flags [.], ack 10528, win 1023, length 0
23:00:27.504385 IP 143.110.216.5.22 > 99.238.174.44.51339: Flags [P.], seq 10528:10564, ack 1045, win 521, length 36
23:00:27.515901 IP 143.110.216.5.22 > 99.238.174.44.51339: Flags [P.], seq 10564:12424, ack 1045, win 521, length 1860
23:00:27.521541 IP 99.238.174.44.51339 > 143.110.216.5.22: Flags [P.], seq 1045:1081, ack 10564, win 1023, length 36
23:00:27.521689 IP 143.110.216.5.22 > 99.238.174.44.51339: Flags [P.], seq 12424:12460, ack 1081, win 521, length 36
23:00:27.532285 IP 99.238.174.44.51339 > 143.110.216.5.22: Flags [.], ack 12424, win 1023, length 0
23:00:27.543024 IP 99.238.174.44.51339 > 143.110.216.5.22: Flags [P.], seq 1081:1117, ack 12460, win 1023, length 36
23:00:27.543188 IP 143.110.216.5.22 > 99.238.174.44.51339: Flags [P.], seq 12460:12496, ack 1117, win 521, length 36
23:00:27.579926 IP 99.238.174.44.51339 > 143.110.216.5.22: Flags [P.], seq 1117:1153, ack 12460, win 1023, length 36
23:00:27.580129 IP 143.110.216.5.22 > 99.238.174.44.51339: Flags [P.], seq 12496:12532, ack 1153, win 521, length 36
23:00:27.601388 IP 99.238.174.44.51339 > 143.110.216.5.22: Flags [P.], seq 1153:1189, ack 12532, win 1023, length 36
23:00:27.601388 IP 99.238.174.44.51339 > 143.110.216.5.22: Flags [.], ack 12532, win 1023, length 0
23:00:27.601568 IP 143.110.216.5.22 > 99.238.174.44.51339: Flags [P.], seq 12532:12568, ack 1189, win 521, length 36
23:00:27.619693 IP 143.110.216.5.22 > 99.238.174.44.51339: Flags [P.], seq 12568:12724, ack 1189, win 521, length 156
23:00:27.619932 IP 143.110.216.5.22 > 99.238.174.44.51339: Flags [P.], seq 12724:13904, ack 1189, win 521, length 1180
23:00:27.619974 IP 143.110.216.5.22 > 99.238.174.44.51339: Flags [P.], seq 13904:13940, ack 1189, win 521, length 36
23:00:27.627862 IP 99.238.174.44.51339 > 143.110.216.5.22: Flags [.], ack 13940, win 1023, length 0
23:00:27.635960 IP 99.238.174.44.51339 > 143.110.216.5.22: Flags [P.], seq 1189:1225, ack 12532, win 1023, length 36
23:00:27.636160 IP 143.110.216.5.22 > 99.238.174.44.51339: Flags [P.], seq 13940:13976, ack 1225, win 521, length 36
23:00:27.648793 IP 99.238.174.44.51339 > 143.110.216.5.22: Flags [P.], seq 1225:1261, ack 13976, win 1023, length 36
23:00:27.648963 IP 143.110.216.5.22 > 99.238.174.44.51339: Flags [P.], seq 13976:14012, ack 1261, win 521, length 36
23:00:27.692231 IP 99.238.174.44.51339 > 143.110.216.5.22: Flags [P.], seq 1261:1297, ack 14012, win 1023, length 36
23:00:27.692484 IP 143.110.216.5.22 > 99.238.174.44.51339: Flags [P.], seq 14012:14048, ack 1297, win 521, length 36
23:00:27.711667 IP 99.238.174.44.51339 > 143.110.216.5.22: Flags [P.], seq 1297:1333, ack 14048, win 1023, length 36
23:00:27.711868 IP 143.110.216.5.22 > 99.238.174.44.51339: Flags [P.], seq 14048:14084, ack 1333, win 521, length 36
^C
119 packets captured
127 packets received by filter
0 packets dropped by kernel
